Chapter_Name,Chapter_Content
Paraíso - Canto Noveno,"Cuando tu Carlos, hermosa Clemencia[58], hubo aclarado mis dudas, me refirió los fraudes de que había de ser víctima su descendencia[59], pero añadió: «Calla y deja transcurrir los años». Así es que yo no puedo decir más, sino que tras de vuestros daños vendrá en llanto originado por un justo castigo.  La santa y viva luz se había vuelto ya hacia el Sol que la inunda, como hacia el bien que a todo alcanza. ¡Oh almas engañadas, locas e impías, que apartáis vuestros corazones de semejante bien, dirigiendo hacia la vanidad vuestros pensamientos! He aquí que otro de aquellos resplandores se dirigió hacia mí, expresando con la claridad que esparcía su deseo de complacerme. Los ojos de Beatriz, que estaban fijos en mí, como antes, me aseguraron el dulce asentimiento que daba a mi deseo.  —¡Oh espíritu bienaventurado! —dije—. Da satisfacción cuanto antes a mi anhelo y pruébame que lo que pienso puede reflejarse en ti sin necesidad de que yo lo exprese con palabras.  Entonces la luz a quien aún no conocía, desde su interior, donde antes cantaba, respondió a mis palabras como quien se complace en ser cortés con otro:  —En aquella parte de la depravada tierra de Italia que está situada entre Rialto y las fuentes del Brenta y del Piave, se eleva una colina no muy alta, de donde descendió una llamarada que causó un gran desastre en toda la comarca. Ella y yo salimos de la misma raíz: Cunizza fui llamada, y aquí brillo porque me venció la luz de esta estrella; pero con alegría me perdono a mí misma mi inclinación amorosa en la vida, y no me pesa, lo cual parecerá difícil de comprender a vuestro vulgo. Esta alma próxima a mí, que es una espléndida y preciosa joya de nuestro Cielo, dejó en la Tierra una gran fama; y antes que su gloria se pierda, este centésimo año se quintuplicará. Ya ves si el hombre debe hacerse ilustre a fin de que su primera vida deje sobre la Tierra una segunda. Esto es lo que no piensa la turba presente que habita entre el Tagliamento y el Adigio, sin que le sirvan de escarmiento los males de que es víctima. Pero pronto sucederá que Padua y sus habitantes, por ser obstinados contra el deber, enrojecerán el agua de la laguna que baña Vicenza, y allí donde el Sile y el Cagnano se unen hay quien domina y va con la cabeza erguida, cuando ya se tejen las redes con que han de cogerlo. También llorará Feltre la felonía de su impío pastor, que será tal que ninguno por otra semejante ha sido encerrado en prisión. Será necesario un recipiente muy ancho para recibir la sangre ferraresa y cansado quedará el que quiera pesar onza a onza la que derramará tan cortés sacerdote por mostrarse hombre de partido, siendo por otra parte tales dones conformes a las costumbres de tal país. Allá arriba hay unos ángeles, que vosotros llamáis Tronos, de donde se reflejan hasta nosotros los juicios de Dios; así es que tenemos por buenas y verídicas nuestras palabras[60].  Al llegar aquí el alma guardó silencio, y habiéndose vuelto a colocar en la órbita como estaba anteriormente, me dio a conocer que no pensaba ya en mí. La otra alma dichosa, a quien ya conocía, se me presentó tan resplandeciente como una piedra preciosa herida por los rayos del Sol. Allí arriba la alegría produce un vivo resplandor, como entre nosotros produce la risa; al contrario que en el Infierno, donde la sombra de los condenados se oscurece cada vez más, a medida que se entristece su espíritu.  —Dios lo ve todo, y tu vista se ensimisma en Él —exclamé—, ¡oh feliz espíritu!, de suerte que ningún deseo puede ocultársete. Así pues, tu voz, que deleita siempre al Cielo uniendo tu canto al de los Serafines, ¿por qué no satisface mis deseos? No esperaría yo por cierto tus respuestas si viera en tu interior como tú puedes ver en el mío.  Entonces contestó con estas palabras:  —El mayor valle en que se vierten las aguas, después de aquel mar que circunda la Tierra, se aleja tanto contra el curso del Sol entre las opuestas playas, que aquel círculo que antes era un horizonte se convierte en meridiano. Yo fui uno de los ribereños de aquel valle, entre el Ebro y el Macra, que por un corto trecho separa al genovés del toscano. Casi a la misma distancia a Oriente y a Occidente se asientan Bugía y la tierra de donde fui, en cuyo puerto se vertió un día la sangre de sus habitantes[61]. Folco me llamó aquella gente, que conocía mi nombre, y este cielo recibe mi luz, como recibí yo su influjo amoroso; pues en tanto que me lo permitió la edad, no ardieron cual yo en aquel fuego la hija de Belo, causando enojos a Siqueo y a Creusa, ni aquella Rodopea que fue abandonada por Demofonte, ni Alcides cuando tuvo a Iole encerrada en su pecho[62]. Aquí empero no hay arrepentimiento, sino regocijo; no de las culpas, que jamás vuelven a la memoria, sino de la Sabiduría que ordenó este cielo y provee sus influjos. Aquí se contempla el arte que adorna y embellece tantas cosas creadas, y se descubre el bien por el cual el mundo de arriba obra directamente sobre el de abajo. Mas, a fin de que queden satisfechos todos los deseos que te han nacido en esta esfera, es preciso que lleves más adelante mis instrucciones. Tú quieres saber quién está en esa luz que centellea cerca de mí como un rayo de sol en el agua pura y cristalina. Sabe, pues, que en su interior es dichosa Rahab y que unida a nuestro coro brilla en él con el resplandor más eminente. Ascendió a este cielo, en el que termina la sombra que proyecta vuestro mundo, antes que ninguna otra alma se viese libre por el triunfo de Cristo[63]. Era justo dejarla en algún cielo como trofeo de la alta victoria que Él alcanzó con su crucifixión, porque aquella mujer favoreció las primeras hazañas de Josué en la Tierra Santa, de la que tan poco se acuerda el Papa. Tu ciudad, que debió su origen a aquel que fue el primero en volver las espaldas a su Hacedor y cuya envidia ocasionó tantas lágrimas, produce y esparce las malditas flores que han descarriado a las ovejas y a los corderos, porque han convertido en lobo al pastor. Por eso están abandonados el Evangelio y los grandes doctores y tan sólo se estudian las Decretales, según lo muestra lo usado de sus márgenes. A esto se dedican el Papa y los cardenales: sus pensamientos no llegan a Nazareth, allí donde Gabriel abrió las alas. Pero el Vaticano y demás sitios elegidos de Roma, que han sido el cementerio de la milicia que siguió a Pedro, pronto se verán libres del adulterio[64]."
Paraíso - Canto Décimo,"El inefable Poder primero, juntamente con su Hijo y con el Amor que de uno y otro eternamente procede, hizo con tanto orden todo cuanto concibe la inteligencia y ven los ojos, que no es posible a nadie contemplarlo sin gustar de sus bellezas. Eleva, pues, lector, conmigo tus ojos hacia las altas esferas, por aquella parte en que un movimiento se encuentra con otro, y empieza a recrearte en la obra del aquel Maestro que la ama tanto en su interior, que jamás separa de ella sus miradas. Observa cómo desde allí se desvía el círculo oblicuo, conductor de los planetas, para satisfacer al mundo que lo llama. Y si el camino de aquéllos no fuese inclinado, más de una influencia en el Cielo sería vana y como muerta aquí abajo toda potencia. Y si al girar se alejaran más o menos de la línea recta, dejaría mucho que desear arriba y abajo el orden del mundo[65]. Ahora, lector, permanece tranquilo en tu asiento, meditando acerca de las cosas que aquí solamente se bosquejan, si quieres que te causen mayor deleite antes que tedio. Te he puesto delante el alimento; tómalo ya por ti mismo, porque el asunto de que escribo reclama para ti todos mis cuidados.  El mayor ministro de la Naturaleza, que imprime en el mundo la virtud del Cielo y mide el tiempo con su luz, giraba, juntamente con aquella parte de que te he hablado antes, por las espirales en que cada día se nos presenta más temprano[66].  Yo ya estaba en él, sin haber notado mi ascensión, sino como nota el hombre una idea después que se le ocurre. Era Beatriz la que de tal modo me hacía pasar de bien a mejor tan súbitamente que su acción no se sujetaba al transcurso del tiempo. ¡Qué luminosas debían ser las almas que se encontraban dentro del Sol, puesto que se distinguían por una mayor luminosidad! Jamás podría imaginarse, aunque para explicarlo llamase en mi auxilio al ingenio, al arte y a todos sus recursos; pero puede creérseme, y debe desearse verlo. Y si nuestra fantasía no alcanza a tal altura, no es maravilla, pues nadie ha visto un resplandor que supere al Sol. Como él era allí la cuarta familia del Padre Supremo, que siempre sacia sus deseos, mostrándole cómo engendra al Hijo y cómo procede el Espíritu[67]. Y Beatriz exclamó:  —Da gracias, da gracias al Sol de los ángeles, que por su bondad te ha elevado a este Sol sensible.  Jamás ha habido un corazón humano tan dispuesto a la devoción y a entregarse a Dios tan vivamente, con todo su agradecimiento, como el mío al oír aquellas palabras; y puso en Él de tal modo mi amor, que Beatriz se eclipsó en el olvido. No le desagradó. Antes, por el contrario, se sonrió, y el esplendor de sus ojos sonrientes hizo que parte de mi pensamiento volviera a pensarla. Vi muchos espíritus vivos y triunfantes, más gratos aún por su voz que relucientes a la vista, los cuales, tomándonos por centro, nos formaron una corona de sí mismos. No de otro modo vemos a veces a la Luna rodeada de un cerco, cuando el aire impregnado de vapores retiene las sustancias de que aquél se compone. En la corte del Cielo, de donde vuelvo, se encuentran muchas joyas tan raras y bellas que no es posible imaginarlas fuera de aquel reino. Y una de estas joyas era el canto de aquellos fulgores. El que no se provea de alas para volar hasta allí, espere tener noticias de aquel canto como si las preguntase a un mudo.  Después que cantando de esta suerte aquellos ardientes soles dieron tres vueltas en derredor nuestro, como las estrellas próximas a los fijos polos, me parecieron semejantes a las mujeres que, sin dejar la postura de la danza, se detienen escuchando con atención hasta que han conocido cuáles son las nuevas notas. Y oí que del interior de una de aquellas luces salían estas palabras:  —Ya que el rayo de la gracia, en que se enciende el verdadero amor y que después crece amando, resplandece en ti tan multiplicado que te conduce hasta arriba por aquella escala de donde nadie desciende sin volver a subir de nuevo, el que negase a tu sed de saber el vino de su redoma, se vería en el mismo estado de violencia en que está el agua impedida de correr hacia el mar. Tú quieres saber de qué flores se compone esta guirnalda que gira en torno de la hermosa Dama que te da ánimos para subir al Cielo. Yo fui uno de los corderos del santo rebaño que condujo Domingo por el camino en que el alma se fortifica si no se extravía. Éste, que está el más próximo a mi derecha, fue mi maestro y mi hermano: es Alberto de Colonia, y yo, Tomás de Aquino. Si quieres saber quiénes son los demás, sigue mis palabras con tus miradas, dando la vuelta a la bienaventurada corona. Aquel otro esplendor brota de la sonrisa de Graciano, tan útil por sus escritos a uno y otro fuero que mereció el Paraíso. El otro que le sigue fue Pedro, que, como la pobre viuda, ofreció su tesoro a la santa Iglesia. La quinta luz, que es la más bella entre nosotros, se abrasa en tal amor que todo el mundo tiene abajo sed de sus noticias. Dentro de ella está el alto espíritu donde se albergó tan profunda sabiduría que, si la verdad es verdad, ningún otro ascendió a tanto saber. Después contempla la luz de aquel cirio que ha sido el que en vida vio mejor la naturaleza y el ministerio de los ángeles. En aquella diminuta luz sonríe el abogado de los tiempos cristianos, cuya doctrina aprovechó Agustín. Si diriges ahora la mirada de tu entendimiento de luz en luz, siguiendo mis elogios, debes tener ya sed de conocer la octava llama. Dentro de ella se recrea en la vista del soberano Bien el alma santa que pone de manifiesto las falacias del mundo a quien atentamente escucha sus doctrinas. El cuerpo de donde fue separada yace en Celdauro y desde el martirio y el destierro ha venido a disfrutar de esta paz celestial. Ve más allá fulgurar el ardiente espíritu de Isidoro, el de Beda y el de Ricardo, que en sus contemplaciones fue más que hombre. Esa de quien se separa tu mirada para fijarse en mí es la luz de un espíritu que, considerando tranquilamente la vanidad del mundo, deseó morir. Es la luz eterna de Siguier, que, ejerciendo el profesorado en la calle del Forraje, excitó la envidia por sus verdaderos silogismos[68]. En seguida, como el reloj que nos llama a la hora en que la Esposa de Dios se levanta para cantar maitines a su Esposo, a fin de que la ame, y cuyas ruedas mueven unas a otras y apresuran a la que va delante hasta que se oye «tin, tin» con notas tan dulces que el espíritu felizmente dispuesto se inflama de amor; así vi yo en la gloriosa esfera moverse y responder las voces a las voces con una armonía tan llena de dulzura, que sólo puede conocerse allá donde la dicha se eterniza."
Paraíso - Canto Undécimo,"¡Oh insensatos afanes de los mortales! ¡Cuán débiles son las razones que os inducen a bajar el vuelo y a rozar la Tierra con vuestras alas! Mientras unos se dedicaban al foro y otros se entregaban a los aforismos de la medicina; y éstos seguían el sacerdocio y aquéllos se esforzaban en reinar por la fuerza de las armas, haciendo creer en su derecho por medio de sofismas; y algunos robaban y otros se consagraban a los negocios civiles; muchos se enervaban en los placeres de la carne y otros, por fin, se daban a la ociosidad; yo, libre de todas estas cosas, había subido con Beatriz hasta el Cielo, donde tan gloriosamente fui acogido. Después que cada uno de aquellos espíritus hubo vuelto al punto del círculo en que antes estaba, tan inmóvil como la bujía en un candelero, la luz que me había hablado anteriormente se hizo más esplendorosa y risueña y dentro de ella oí su voz, que comenzó a decir de esta manera:  —Así como yo me enciendo a los rayos de la luz eterna, del mismo modo, mirándola, conozco la causa de donde proceden tus pensamientos[69]. Tú dudas y quieres que mi boca emplee palabras tan claras y ostensibles que pongan al alcance de tu inteligencia las que pronuncié antes cuando. dije: «Camino en que el alma se fortifica»; y aquellas otras: «Ningún otro ascendió». En cuanto a estas últimas, es preciso hacer una distinción. La Providencia, que gobierna el mundo con una ciencia en la que se pierde la mirada de todo ser creado sin poder llegar a comprenderla, a fin de que la Iglesia, esposa de Aquel que con su sangre la desposó, corriese hacia su fin segura de acechanzas y fiel a sus principios, quiso que dos paladines la sirvieran como guías para su seguridad y su fidelidad. El uno fue todo seráfico en su ardor; el otro por su sabiduría resplandeció en la Tierra con la luz de los querubines[70]. Hablaré de uno solo: pues elogiando a cualquiera de ellos indistintamente se habla de los dos, porque sus obras tendieron a un mismo fin. Entre el Tupino y el agua que desciende del collado elegido por el beato Ubaldo, baja un fértil declive de un alto monte, del cual Perusa siente venir el calor y el frío por la parte de Porta Sole y tras de cuyo monte lloran las oprimidas Nocera y Gualdo. En el sitio donde aquella pendiente es menos rápida, vino al mundo un sol, resplandeciendo como éste a veces cuando asoma sobre las márgenes del Ganges. Quien hable de este lugar, no lo llame Asís, pues diría muy poco: si quiere hablar con propiedad, llámelo Oriente[71]. Aún no distaba mucho de su nacimiento, cuando aquel sol comenzó a hacer que la Tierra sintiese algún consuelo con su gran virtud, pues siendo todavía muy joven, incurrió en la cólera de su padre por inclinarse a una dama, a quien, como a la muerte, nadie acoge con gusto. Y ante la corte espiritual y «coram patre» se unió a ella, amándola después más y más cada día. Ella, privada de su primer marido, permaneció despreciada y oscura mil cien años y más, sin que nadie la solicitase hasta que vino éste[72]. De nada le valió que se oyera decir cómo aquel que hizo temer a todo el mundo la encontró alegre con Amiclates cuando llamó a su puerta[73], ni le valió haber sido constante y animosa hasta el punto de ser crucificada con Cristo mientras María estaba al pie de la cruz. Mas, para no continuar en un estilo demasiado oscuro, reconoce en mis difusas palabras que estos dos amantes son Francisco y la Pobreza. Su concordia y sus placenteros semblantes, su amor maravilloso y sus dulces miradas inspiraban santos pensamientos a otros; de tal modo que el venerable Bernardo fue el primero que se descalzó para correr en pos de tanta paz, y aun corriendo le parecía llegar tarde. ¡Oh riqueza ignorada! ¡Oh verdadero bien! Egidio se descalza, se descalza también Silvestre por seguir al Esposo; tanto es lo que les agrada la Esposa. Desde allí partió aquel padre y maestro con su mujer y con aquella familia ceñida ya del humilde cordón. Y sin que una vil cobardía le hiciese bajar la frente por ser hijo de Bernardone, ni por su apariencia asombrosamente despreciable, manifestó con gran dignidad sus rígidas intenciones a Inocencio, de quien recibió la primera aprobación de su regla. Luego que fue aumentando en torno suyo la pobre gente, cuya admirable vida se cantaría mejor entre las glorias del Cielo, el eterno Espíritu, valiéndose de Honorio, coronó de nuevo el santo propósito de aquel pastor[74]; y cuando éste, sediento de martirio, predicó en presencia del soberbio Sultán la doctrina de Cristo y de los que lo siguieron, encontrando a aquella gente poco dispuesta a la conversión, para no permanecer inactivo, volvió a recoger el fruto de las plantas de Italia[75]. Cuando plugo a Aquel que lo había elegido para tan ardua tarea elevarlo a la recompensa que mereció por haberse humillado, recomendó a sus hermanos, como a herederos legítimos, el cuidado de su querida Esposa y que la amaran con fe; y en el seno de ella quiso el alma preclara desprenderse para volver a su reino, sin permitir que a su cuerpo se le diera otra sepultura. Piensa ahora cuál fue el digno colega de Francisco, encargado de mantener la barca de Pedro en alta mar y dirigirla hacia su objeto. Ése fue nuestro patriarca; por lo cual, el que le sigue según él manda, puede decir que adquiere buena mercancía. Pero su rebaño se ha vuelto tan codicioso del nuevo alimento, que no puede menos de esparcirse por diversos prados; y cuanto más lejos de él van sus vagabundas ovejas, más exhaustas de leche vuelven al redil. Algunas de ellas, temiendo el peligro, se agrupan junto a su pastor, pero son tan pocas que no se necesita mucho paño para sus capas. Así pues, si mis palabras no son oscuras, si me has escuchado con atención y si tu mente recuerda lo que te he dicho, tu deseo debe estar en parte satisfecho; porque habrás visto la causa de que la planta se desgaje y comprenderás la distinción que hice al decir: «Donde el alma se fortifica, si no se extravía[76]»."
Paraíso - Canto Duodecimo,"En cuanto la bendita llama hubo dicho su última palabra, empezó a girar la santa rueda, y aún no había dado una vuelta entera cuando otra la encerró en su círculo, uniendo movimiento a movimiento y canto a canto. Y eran éstos tales que, articulados por los dulces órganos de aquellos espíritus, sobrepujaban a los de nuestras Musas y nuestras Sirenas, tanto como la luz directa supera a sus reflejos. Cual se ve a dos arcos paralelos y del mismo color encorvarse sobre una ligera nube cuando Juno envía a su mensajera (naciendo el de fuera del de dentro, al modo de la voz de aquella ninfa a quien consumió el amor como el Sol consume los vapores), y cuyos arcos son un presagio para los hombres a causa del pacto que Dios hizo con Noé de que el mundo no volverá a sufrir otro diluvio, de igual suerte aquellas dos guirnaldas de sempiternas rosas daban vueltas en torno de nosotros, correspondiendo en todo la guirnalda exterior a la interior[77]. Cuando cesaron simultánea y unánimemente las danzas y los fulgurantes y mutuos destellos de aquellas luces gozosas y placenteras, semejantes a los ojos que se abren y se cierran al mismo tiempo, dóciles a la voluntad del que los mueve, del seno del nuevo círculo salió una voz, la cual hizo que me volviese hacia ella, como la aguja hacia el polo. Aquella voz empezó a decir:  —El amor que me embellece me obliga a tratar del otro patriarca, ya que se habla tan bien del mío. Es justo que donde se hace mención del uno se haga también del otro, pues habiendo militado ambos por una misma causa, debe brillar su gloria juntamente. El ejército de Cristo[78], al que tan caro costó armar de nuevo, seguía su enseña lento, receloso y escaso, cuando el Emperador que siempre reina acudió en ayuda de su milicia que se hallaba en peligro, no porque ésta fuera digna de ello, sino por un efecto de su gracia. Y, según se ha dicho, socorrió a su Esposa con dos campeones ante cuyas obras y palabras se reunió el descarriado pueblo. En aquella parte de donde el dulce céfiro acude para hacer germinar las nuevas plantas de que se reviste la Europa, no muy lejos de los embates de las olas tras de las cuales, por su larga extensión, el Sol se oculta a veces a todos los hombres, se asienta la afortunada Caleruega bajo la protección del gran escudo en que el león está subyugado y subyuga a su vez[79]. En ella nació el apasionado amante de la fe cristiana, el santo atleta, benigno para los suyos y cruel para sus enemigos. Apenas fue creada, su alma se llenó de virtud tan viva, que en el seno mismo de su madre inspiró a ésta el don de profecía[80]. Cuando se celebraron los esponsales entre él y la Fe en la sagrada pila, donde se dotaron de mutua salud, la mujer que dio por él su asentimiento vio en sueños el admirable fruto que debía salir de él y sus herederos. Y para hacer más visible lo que ya era, descendió del Cielo un espíritu y le dio el nombre de Aquel que lo poseía por completo[81]. Domingo se llamó; y habló de él como del labrador que Cristo escogió para que lo ayudase a cultivar su huerto. Pareció en efecto enviado y familiar de Cristo, porque el primer deseo que se manifestó en él fue el de seguir el primer consejo de Cristo[82]. Muchas veces su nodriza lo encontró despierto y arrodillado en el suelo, como diciendo: «He venido para esto[83]». ¡Oh padre verdaderamente Félix!, ¡Oh madre verdaderamente Juana[84], si la interpretación de sus nombres es la que se les da! En poco tiempo llegó a ser un gran doctor, no por esa vanidad humana por la que se afanan hoy todos tras del Ostiense y de Tadeo, sino por amor hacia el verdadero maná[85]; entonces se puso a custodiar la viña que pierde en breve su verdura si el viñador es malo, y habiendo acudido a la Sede que en otro tiempo fue más benigna de lo que es ahora para los pobres justos, no por culpa suya, sino del que en ella se sienta y la mancilla, no pidió la facultad de dispensar dos o tres por seis, no pidió el primer beneficio vacante, «non decimas, quae sunt pauperum Dei», sino que pidió licencia para combatir los errores del mundo[86] y en defensa de las semillas que nacieron las veinticuatro plantas que te rodean[87]. Después, con su doctrina y su voluntad juntamente, corrió a desempeñar su misión apostólica, cual torrente que se desprende de un elevado origen, y su ímpetu atacó con más vigor los retoños de la herejía allí donde era mayor la resistencia. De él salieron en breve varios arroyos con los que se regó el jardín católico, de modo que sus arbustos adquirieron más vida. Si tal fue una de las ruedas del carro en que se defendió la santa Iglesia, venciendo en el campo de las discordias civiles, bastante debes conocer ya la excelencia de la otra rueda de la que te ha hablado Tomás con tantos elogios antes de mi llegada. Pero el carril trazado por la parte superior de la circunferencia de esta última rueda está abandonado, de suerte que ahora se halla el mal donde antes el bien. La familia que seguía fielmente las huellas de Francisco ha cambiado tanto su marcha, que pone la punta del pie donde él ponía los talones; pero pronto verá la cosecha que ha producido tan mal cultivo, cuando la cizaña se queje de que no se la lleve al granero[88]. Convengo en que quien examine hoja a hoja nuestro libro aún encontraría una página en que leería: «Yo soy el que acostumbro», pero no procederá de Casale ni de Aquasparta, de donde vienen algunos que o huyen del rigor de la regla o aumentan desmesuradamente su austeridad[89]. Yo soy el alma de Buenaventura de Bagnoreggio, que en mis grandes cargos pospuse siempre los cuidados temporales a los espirituales[90]. Iluminato y Agustín están aquí; éstos fueron de los primeros pobres descalzos que, llevando el cordón, se hicieron amigos de Dios. Con ellos están Hugo de San Víctor, Pedro Mangiadore y Pedro Hispano, el cual brilló allá abajo por sus doce libros; el profeta Nathan y el metropolitano Crisóstomo y Anselmo y aquel Donato que se dignó poner su mano en la primera de las artes. Aquí está también Rabano y a mi lado brilla Joaquín, abad de Calabria, que estuvo dotado de espíritu profético[91]. He debido alabar a aquel gran paladín de la Iglesia que es Domingo por moverme a ello la ardiente simpatía y las discretas palabras de fray Tomás, que, así como a mí, han conmovido a estas almas."
